{
    "$schema": "../../../schemas/hostTrade.schema.json",
    "id": "018-hostTrade-chajari-cerrajeria",
    "name": "Cerrajería y Seguridad Chajarí",
    "slug": "cerrajeria-y-seguridad-chajari",
    "category": "CERRAJERIA",
    "contact": "https://wa.me/5493458123456",
    "benefit": "Duplicado de llaves y cajas fuertes con 15% de descuento para alojamientos Hospeda.",
    "destinationId": "001-destination-chajari",
    "is24h": true,
    "scheduleText": null,
    "isActive": true,
    "createdById": "super-admin-user"
}
